MIX_ID;MIX_Typ;MIX_Familien_ID;Original_Name;Name_deutsch;Kategorie;Kategorie_multi;Form_multi;Verwendungsbereich_multi;Anwendung_multi;Sensorik;Sensorik_multi;Herkunft;Original_Region;Region_norm;Kultureller_Hintergrund;Textur;Kalt_Warm;Stoffe_Gewuerze;Stoffe_Kraeuter;Stoffe_Salze;Stoffe_Oele;Stoffe_Harze;Stoffe_Sonstige;Zutaten_Liste;Zutaten_Mengen_Structured;Herstellung_Zubereitung;Herstellungsprozess;Temperaturfuehrung;Reifezeit_Lagerzeit;Anwendung;Sicherheitshinweise;Haltbarkeit;Behaelter_Verpackung;PlH_Illu;PlH_QR;Illu prompt positiv;Illu prompt negativ;Illu type;Status
MIX-CHI-00003-G-000;G;CHI-00003;Pebre;Pebre;Frische Würzsalsa;Salsa|Dip;Gewürfelt;Fleisch|Brot|Eintöpfe;Kalt|Mischen;frisch|säuerlich|kräuterig|mild-scharf|knackig|süß;frisch|säuerlich|kräuterig;Südamerika|Chile;Zentralregion;Asado-Kultur;Pebre ist ein Symbol der chilenischen Alltagsküche, eine Mischung aus indigenen Zutaten (Aji, Koriander) und spanischen Einflüssen (Essig). Wird immer roh und frisch am Tisch serviert.;fein gewürfelt|saftig|roh;Kalt;;STF_KorianderFrisch;;STF_OelNeutral|STF_Olivenoel;STF_Salz;STF_Tomate|STF_Zwiebel|STF_AjiVerdeFrisch|STF_Knoblauch|STF_EssigWeisswein;Tomate|Zwiebel|Koriander|Aji Verde|Knoblauch|Weißweinessig|Öl;STF_Tomate:120g|STF_Zwiebel:60g|STF_KorianderFrisch:20g|STF_AjiVerdeFrisch:10g|STF_Knoblauch:6g|STF_EssigWeisswein:25ml|STF_OelNeutral:20ml|STF_Salz:5g;Tomaten entkernen und fein würfeln. Zwiebeln und Aji Verde fein hacken. Koriander und Knoblauch fein schneiden. Alle Zutaten mischen. Essig und Öl einrühren. 20–30 Minuten ziehen lassen.;Schneiden → Mischen → Ziehen lassen;Niemals erhitzen;Reife: 20–30 min|Lager: 1–2 Tage (gekühlt);Wichtigster Dip zum Brot|Zu Empanadas|Topping für Suppen;Rohe Zwiebel → kurze Haltbarkeit;1–2 Tage (gekühlt);Glas luftdicht;MIX-00000104-A;MIX-00000104;;;G;nan
MIX-BOL-00003-G-000;G;BOL-00003;Llajwa;Llajwa;Frische Würzpaste;Salsa|Schärfe|Kräuter;Paste|Grob;Eintöpfe|Fleisch|Empanadas;Kalt|Zerreiben;sehr scharf|frisch|fruchtig|kräuterig|süßlich|intensiv;scharf|frisch|fruchtig;Südamerika|Bolivien|Altiplano;La Paz;Anden;Llajwa ist eine der ältesten überlieferten Würzpasten der Anden. Sie wird traditionell mit dem Batán (Steinmörser) zerrieben und basiert auf Locoto (Rocoto) Chili und Tomate. Sie ist extrem scharf.;leicht körnig|roh|saftig;Kalt;;STF_KorianderFrisch;;;STF_Salz;STF_LocotoFrisch|STF_Tomate|STF_Zwiebel;Locoto|Tomate|Koriander|Zwiebel|Salz;STF_LocotoFrisch:60g|STF_Tomate:150g|STF_KorianderFrisch:15g|STF_Zwiebel:10g|STF_Salz:4g;Locoto halbieren, schwarze Samen entfernen. Tomaten grob würfeln. Koriander grob schneiden. Alle Zutaten (optional im Mörser/Batán) zerreiben. Salz einarbeiten. 10–15 Minuten ziehen lassen.;Zerreiben → Salzen → Ziehen;Niemals erhitzen;Reife: 10–15 min|Lager: 1–2 Tage (gekühlt);1 EL = sehr scharf|Perfekt zu Suppen und Empanadas|Streetfood-Standardwürze;Locoto ist sehr scharf (Handschuhe);1–2 Tage (gekühlt);Glas luftdicht;MIX-00000105-A;MIX-00000105;;;G;nan
MIX-KOL-00010-G-000;G;KOL-00010;Hogao;Hogao;Gekochte Würzbasis;Sofrito|Basis|Aromatisch;Sämig|Paste;Bohnen|Reis|Eintöpfe|Arepas;Warm|Schmoren|Dünsten;warm|mild-süß|aromatisch|tomatig|rund|sanft;warm|süß;Südamerika|Kolumbien;Antioquia;Kreolische Hausküche;Hogao ist das kolumbianische Äquivalent zum Sofrito. Es ist die aromatische Basis fast aller Gerichte und zeichnet sich durch den hohen Anteil an Zwiebeln und Frühlingszwiebeln und das typische Achiote-Öl aus.;weich|sämig|Paste;Warm|Schmoren;STF_Kreuzkümmel|STF_PfefferSchwarz;;;STF_OelNeutral|STF_AchioteOel;STF_Salz;STF_Zwiebel|STF_Tomate|STF_Fruehlingszwiebel|STF_Knoblauch;Zwiebel|Tomate|Frühlingszwiebel|Knoblauch|Achiote-Öl|Öl;STF_Zwiebel:150g|STF_Tomate:100g|STF_Fruehlingszwiebel:40g|STF_Knoblauch:6g|STF_OelNeutral:20ml|STF_AchioteOel:10ml|STF_Salz:4g|STF_Kreuzkümmel:1g|STF_PfefferSchwarz:1g;Zwiebeln fein würfeln. Zwiebeln und Frühlingszwiebeln in Achiote-Öl und normalem Öl bei niedriger Hitze 8–12 Minuten schmoren (süßen, nicht bräunen). Tomaten zugeben und 10–15 Minuten köcheln lassen, bis sie zerfallen. Knoblauch, Salz und Gewürze einarbeiten.;Schmoren → Tomatisieren → Reduzieren;Kochen ≤ 100 °C;Reife: 10–15 min|Lager: 3–4 Tage (gekühlt)|2 Monate (gefroren);1–2 EL pro Arepa|Als Sofrito-Basis für Bohnen und Reisgerichte;Achiote färbt extrem;3–4 Tage (gekühlt);Glas luftdicht;MIX-00000106-A;MIX-00000106;;;G;nan
MIX-VEN-00003-G-000;G;VEN-00003;Guasacaca;Guasacaca;Frische grüne Sauce;Salsa|Dip|Avocado;Paste|Flüssig;Grillen|Arepas|Fleisch;Kalt|Mischen;cremig|frisch|kräuterig|leicht säuerlich|mild-scharf|hellgrün;frisch|säuerlich|cremig;Südamerika|Venezuela;Zulia;Parrilla-Tradition;Guasacaca ist die klassische, cremige, grüne Tischsauce der venezolanischen Grillkultur (Parrilla). Sie ist dünner und kräuterlastiger als mexikanische Guacamole und wird mit Essig emulgiert.;cremig-flüssig|glatt|hellgrün;Kalt;;STF_ChiliFrisch;STF_KorianderFrisch|STF_PetersilieFrisch;;STF_OelNeutral;STF_Salz;STF_Avocado|STF_Zwiebel|STF_Knoblauch|STF_EssigWeisswein|STF_PaprikaGruen;Avocado|Paprika|Zwiebel|Koriander|Petersilie|Knoblauch|Essig|Öl;STF_Avocado:150g|STF_PaprikaGruen:60g|STF_Zwiebel:40g|STF_KorianderFrisch:20g|STF_PetersilieFrisch:10g|STF_Knoblauch:6g|STF_EssigWeisswein:25ml|STF_OelNeutral:30ml|STF_Salz:5g|STF_ChiliFrisch:5g;Alle Zutaten (Avocado, Paprika, Zwiebel, Kräuter, Knoblauch) grob schneiden. Essig und Öl in den Mixer geben. Kurz mixen, bis eine glatte, leichte Emulsion entsteht (nicht zu dick). Salz einarbeiten. 10–15 Minuten ziehen lassen.;Schneiden → Mixen → Emulgieren → Ruhen;Niemals erhitzen;Reife: 10–15 min|Lager: 1 Tag (gekühlt)|2 Monate (gefroren);1–2 EL pro Portion|Dip für Yuca und Arepas|Unverzichtbar zur Parrilla;Avocado oxidiert schnell (sofort abdecken);1 Tag (gekühlt);Glas luftdicht;MIX-00000107-A;MIX-00000107;;;G;nan
MIX-KOL-00011-G-000;G;KOL-00011;Aji Picante;Aji Picante;Frische Würzpaste;Salsa|Schärfe;Flüssig;Empanadas|Fleisch|Eintöpfe;Kalt|Mischen;sehr scharf|frisch|zitronig-sauer|leicht krautig|hell;scharf|sauer|frisch;Südamerika|Kolumbien;Bogotá;Andine Hausküche;Aji Picante ist die klassische, dünnflüssige Tischsauce Kolumbiens, die in jedem Restaurant serviert wird. Sie ist essigsauer und zitronig, im Gegensatz zu sämigeren Salsas.;flüssig-dünn|pulpy;Kalt;STF_ChiliPicanteFrisch;;STF_KorianderFrisch;;STF_Salz;STF_Zwiebel|STF_Tomate|STF_Limette|STF_EssigWeisswein|STF_Wasser;Chili|Zwiebel|Tomate|Koriander|Limettensaft|Essig|Wasser;STF_ChiliPicanteFrisch:40g|STF_Zwiebel:30g|STF_Tomate:20g|STF_KorianderFrisch:10g|STF_Limette:20ml|STF_EssigWeisswein:15ml|STF_Wasser:80ml|STF_Salz:4g;Alle Zutaten grob hacken. Mit Limettensaft, Essig und Wasser in den Mixer geben. Nur kurz mixen, um eine flüssige, nicht sämige Konsistenz zu erreichen. Salz einarbeiten. 15–20 Minuten ziehen lassen.;Schneiden → Mixen → Verdünnen → Ruhen;Niemals erhitzen;Reife: 15–20 min|Lager: 2–3 Tage (gekühlt);Zu Empanadas|Als Topping für Suppen und Eintöpfe;Frische Chilis sind sehr scharf;2–3 Tage (gekühlt);Glasflasche luftdicht;MIX-00000108-A;MIX-00000108;;;G;nan
MIX-JAM-00003-G-000;G;JAM-00003;Jamaican Jerk Seasoning;Jamaican Jerk Seasoning;Trockene Gewürzmischung;BBQ|Scharf|Marinade;Pulver|Rub;Fleisch|Grillen|Schmoren;Kalt|Warm|Marinieren;warm-würzig|intensiv aromatisch|süß-scharf|pimentbetont|kräuterig|rauchig;scharf|pimentbetont|süß;Karibik|Jamaika;Inselweit;Maroons-Kultur;Jerk ist tief in der Geschichte der Maroons verwurzelt. Das Aroma ist einzigartig durch die Kombination von Allspice (Piment), Scotch Bonnet Chili und der traditionellen Grillmethode über Pimentholz.;Pulver;Warm|Kalt;STF_Piment|STF_PfefferSchwarz|STF_Zimt|STF_Muskat|STF_Nelken|STF_ScotchBonnetGetrOderPulver;STF_ThymianGetr;STF_Salz;;STF_BraunerZucker;Piment|Pfeffer|Zimt|Muskat|Nelken|Thymian|Brauner Zucker|Salz|Scotch Bonnet;STF_Piment:30g|STF_PfefferSchwarz:20g|STF_Zimt:10g|STF_Muskat:5g|STF_Nelken:3g|STF_ThymianGetr:10g|STF_BraunerZucker:40g|STF_Salz:10g|STF_ScotchBonnetGetrOderPulver:7g;Alle Gewürze mischen. (Für Wet Paste: Mit Öl, Essig, frischem Knoblauch/Zwiebeln pürieren). Für Dry Rub: Alle Pulver und groben Bestandteile vermischen und 1 Stunde ruhen lassen.;Mischen → Ruhen;Nicht über 200 °C (Zucker brennt);Reife: 1 h|Lager: 3–4 Monate (trocken);1 EL pro 250 g Fleisch|Mit Öl/Essig zur Marinade machen|Beim Grillen regelmäßig bepinseln;Scotch Bonnet ist extrem scharf;3–4 Monate (trocken);Glas luftdicht;MIX-00000109-A;MIX-00000109;;;G;nan
MIX-TRI-00002-G-000;G;TRI-00002;Caribbean Green Seasoning;Caribbean Green Seasoning;Frische Kräuterpaste;Marinade|Basis|Kräuter;Paste;Fleisch|Fisch|Curries|Eintöpfe;Kalt|Anschwitzen;frisch|kräuterig|zitronig|mild-scharf|intensiv aromatisch|grün;frisch|kräuterig|zitronig;Karibik|Trinidad & Tobago;Trinidad;Indo-Karibisch;Green Seasoning ist die aromatische Allzweckbasis der gesamten Karibik. Es ist ein frischer Mix aus Culantro (Shado Beni), Kräutern, Knoblauch und Chili, der in großen Mengen vorbereitet und eingefroren wird.;feines bis mittelfeines Püree|feucht|grün;Kalt|Anschwitzen;STF_ChiliFrisch;STF_KorianderFrisch|STF_PetersilieFrisch|STF_ThymianFrisch;;;STF_Salz;STF_Fruehlingszwiebel|STF_Zwiebel|STF_Sellerie|STF_Knoblauch|STF_ScotchBonnetFrisch|STF_Limette|STF_EssigWeisswein;Frühlingszwiebel|Koriander|Petersilie|Thymian|Zwiebel|Knoblauch|Sellerie|Scotch Bonnet|Limettensaft|Salz;STF_Fruehlingszwiebel:50g|STF_KorianderFrisch:25g|STF_PetersilieFrisch:15g|STF_ThymianFrisch:5g|STF_Zwiebel:40g|STF_Knoblauch:12g|STF_Sellerie:40g|STF_ScotchBonnetFrisch:5g|STF_Limette:15ml|STF_Salz:4g|STF_EssigWeisswein:5ml;Alle frischen Zutaten grob schneiden. Mit Limettensaft und Essig in den Mixer geben und pürieren (ggf. etwas Wasser). Salz einarbeiten. 20–30 Minuten ziehen lassen. Ideal zum Einfrieren in Portionen.;Schneiden → Pürieren → Ruhen;Niemals erhitzen;Reife: 20–30 min|Lager: 3–4 Tage (gekühlt)|2 Monate (gefroren);1–2 EL als Marinade|Basis für Currys und Eintöpfe;Frische Kräuter → Oxidation;3–4 Tage (gekühlt);Luftdichtes Glas (Eiswürfelformen zum Einfrieren);MIX-00000110-A;MIX-00000110;;;G;nan
MIX-KUB-00002-G-000;G;KUB-00002;Mojo Criollo;Mojo Criollo;Flüssige Marinade;Marinade|Dip;Flüssig;Fleisch|Yuca|Grillen;Kalt|Warm|Marinieren;zitronig-sauer|kräftig knoblauchartig|leicht kräuterig|warm-würzig|frisch;sauer|knoblauchlastig|würzig;Karibik|Kuba;Inselweit;Kubanische Hausküche|Kanarischer Ursprung;Mojo (Mo-ho) stammt ursprünglich von den Kanaren, wurde in Kuba aber mit Knoblauch, Bitterorange und Kreuzkümmel zur klassischen Marinade für Schweinefleisch adaptiert.;dünnflüssig|leicht ölig|aromatisch;Kalt|Warm;STF_OreganoGetr|STF_Kreuzkuemmel;;;STF_OelNeutral;STF_Salz;STF_Knoblauch|STF_Zitrone|STF_Limette|STF_Orange|STF_EssigWeisswein;Knoblauch|Bitterorange/Zitrone|Essig|Öl|Oregano|Kreuzkümmel|Salz;STF_Knoblauch:30g|STF_Orange:40ml|STF_Limette:20ml|STF_EssigWeisswein:20ml|STF_OelNeutral:40ml|STF_OreganoGetr:2g|STF_Kreuzkuemmel:2g|STF_Salz:6g;Knoblauch fein hacken. Zitronen- und Orangensaft auspressen. Öl, Essig, Knoblauch, Oregano, Kreuzkümmel und Salz verrühren. 20–30 Minuten ziehen lassen. Kann für Yuca con Mojo leicht erwärmt werden.;Mischen → Emulgieren → Ruhen;Max. 90 °C (beim Erwärmen);Reife: 20–30 min|Lager: 3–4 Tage (gekühlt);Als Marinade für Schweinefleisch|Warm über gekochte Yuca gießen;Hoher Anteil an rohem Knoblauch|Kühlung strikt einhalten;3–4 Tage (gekühlt);Glas luftdicht;MIX-00000111-A;MIX-00000111;;;G;nan
MIX-PUE-00002-G-000;G;PUE-00002;Sofrito;Sofrito (Puerto Rico);Gekochte Würzbasis;Basis|Kräuter|Aromatisch;Püree|Paste;Reis|Bohnen|Schmorgerichte;Kalt|Warm|Anschwitzen;kräuterig-frisch|leicht süßlich|mild aromatisch|sanft|rund|grün;frisch|kräuterig|mild;Karibik|Puerto Rico;Inselweit;Kreolische Hausküche;Sofrito ist das kulinarische Fundament der puerto-ricanischen Küche. Es wird in großen Mengen vorbereitet und ist durch Culantro (Recao), Aji Dulce und viel Knoblauch charakterisiert. Oft wird es portionsweise eingefroren.;feines Püree|grün|feucht;Kalt|Warm;STF_PaprikaGruen;STF_KorianderFrisch|STF_PetersilieFrisch|STF_OreganoFrisch;STF_Salz;STF_OelNeutral;STF_Culantro|STF_AjiDulce|STF_Zwiebel|STF_Knoblauch|STF_Tomate;Culantro|Aji Dulce|Paprika|Zwiebel|Knoblauch|Petersilie|Öl;STF_Culantro:25g|STF_KorianderFrisch:20g|STF_PetersilieFrisch:10g|STF_AjiDulce:50g|STF_PaprikaGruen:40g|STF_Zwiebel:50g|STF_Knoblauch:12g|STF_Tomate:20g|STF_OreganoFrisch:3g|STF_OelNeutral:10ml|STF_Salz:2g;Alle frischen Zutaten (Kräuter, Aji Dulce, Paprika, Zwiebel, Knoblauch, optional Tomate) grob schneiden. Mit 1–2 EL Öl in den Mixer geben und pürieren (nicht zu flüssig). Salz einarbeiten. Für Kochbasis 1–2 Min. sanft anschwitzen. Ideal zum Einfrieren.;Pürieren → (Optional) Anschwitzen → Ruhen;Niemals bräunen;Reife: 15–20 min|Lager: 3–4 Tage (gekühlt)|3 Monate (gefroren);1–3 EL pro Gericht|Unverzichtbar für Reis und Bohnen|Basis für Schmorgerichte;Frische Kräuter → Oxidation|Geringe Haltbarkeit gekühlt;3–4 Tage (gekühlt);Plastik luftdicht (Eiswürfelform);MIX-00000112-A;MIX-00000112;;;G;nan
MIX-OST-00009-G-000;G;OST-00009;Mekelesha;Ethiopian Mekelesha;Trockene Gewürzmischung;Finish|Aromatisch;Pulver;Wot|Eintöpfe;Warm|Mischen;warm|würzig|leicht süßlich|mild|aromatisch|rund|tief;warm|süßlich|rund;Afrika|Äthiopien;Addis Abeba;Äthiopische Wot-Küche;Mekelesha ist das "End-Gewürz" der äthiopischen Küche und ergänzt Berbere. Es wird erst in den letzten Minuten der Kochzeit hinzugefügt, um die flüchtigen Aromen von Kardamom und Zimt zu bewahren.;fein gemahlen;Warm|Mischen;STF_Koriandersamen|STF_KardamomSchwarzAethiopisch|STF_Zimt|STF_Gewuerznelken|STF_PfefferSchwarz|STF_Muskat|STF_Piment|STF_Ajwain;;;;;Kardamom|Zimt|Nelken|Pfeffer|Muskat|Piment|Ajwain;STF_KardamomSchwarzAethiopisch:10g|STF_PfefferSchwarz:6g|STF_Zimt:8g|STF_Gewuerznelken:2g|STF_Piment:2g|STF_Ajwain:2g|STF_Koriandersamen:10g|STF_Muskat:2g;Alle Gewürze (außer Muskat) mild rösten. Abkühlen lassen. Sehr fein mahlen. Muskat frisch reiben und untermischen. 12–24 Stunden ruhen lassen.;Mildes Rösten → Abkühlen → Mahlen → Ruhen;Max. 100–120 °C beim Rösten;Reife: 12–24 h|Lager: 3–4 Monate;½–1 TL am Ende der Kochzeit|Nicht mitkochen (Aromaverlust)|Mit Niter Kibbeh kombinieren;Nelken und Piment sind intensiv;3–4 Monate;Aromadichte Dose;MIX-00000116-A;MIX-00000116;;;G;nan
MIX-NOR-00009-G-000;G;NOR-00009;L’Msakhan Spice;Moroccan L’Msakhan Spice;Trockene Gewürzmischung;Tajine|Geflügel|Warm;Pulver;Geflügel|Tajines|Süßspeisen;Warm|Anschwitzen|Mischen;warm|leicht süßlich|zart würzig|aromatisch|tief|gelb;warm|süßlich|würzig;Afrika|Marokko;Fès;Marokkanische Küche;L’Msakhan (was "wärmend" bedeutet) ist eine Gewürzmischung, die oft in der traditionellen Marokkanischen Küche mit Geflügel (Hähnchen) oder Taube geschmort wird. Es ist milder als Ras el Hanout, aber zentriert auf Zimt, Ingwer und Kurkuma.;fein gemahlen|gelblich-gold;Warm|Anschwitzen;STF_Zimt|STF_Safran|STF_Kurkuma|STF_IngwerGemahlen|STF_PfefferSchwarz|STF_Muskat|STF_PaprikaEdelsuess;;;STF_Salz;Zimt|Safran|Kurkuma|Ingwer|Pfeffer|Muskat|Paprika;STF_Zimt:20g|STF_Safran:0.25g|STF_Kurkuma:20g|STF_IngwerGemahlen:20g|STF_PfefferSchwarz:10g|STF_Muskat:2g|STF_PaprikaEdelsuess:5g|STF_Salz:2g;Alle Gewürze (außer Safran) mischen. Safran im Mörser zerreiben und untermischen. 1 Stunde ruhen lassen.;Mischen → Ruhen;Niedrige Hitze beim Kochen;Reife: 1 h|Lager: 3–4 Monate;1–2 TL pro Gericht|Mit Öl anschwitzen für Tajines|Safran erst in Flüssigkeit geben;Zimt und Kurkuma können bei Überhitzung bitter werden;3–4 Monate;Aromadichtes Glas;MIX-00000117-A;MIX-00000117;;;G;nan
MIX-NOR-00010-G-000;G;NOR-00010;Ras el Hanout (Schwarz);Algerian Ras el Hanout (schwarz);Trockene Gewürzmischung;Tajine|Komplex|Warm;Pulver;Lamm|Rind|Couscous;Warm|Anschwitzen|Mischen;warm|erdig|tief|pfeffrig|würzig|leicht bitter|komplex;warm|erdig|pfeffrig;Afrika|Algerien;Algier;Marokkanische|Berberküche;Die algerische schwarze Variante von Ras el Hanout ist erdiger und kräftiger als die marokkanische, oft mit Kakao oder dunklem Paprika angereichert. Sie wird durch den hohen Anteil an warmen, dunklen Gewürzen definiert.;fein gemahlen|dunkelbraun;Warm|Anschwitzen;STF_PfefferSchwarz|STF_Koriandersamen|STF_Kreuzkuemmel|STF_Nelken|STF_Zimt|STF_Piment|STF_IngwerGemahlen|STF_Kurkuma|STF_Muskat|STF_PaprikaDunkel;STF_Kakao;;;;STF_Salz;Pfeffer|Koriander|Kreuzkümmel|Nelken|Zimt|Piment|Ingwer|Kurkuma|Muskat|Paprika|Kakao;STF_PfefferSchwarz:25g|STF_Koriandersamen:20g|STF_Kreuzkuemmel:15g|STF_Nelken:2g|STF_Zimt:8g|STF_Piment:6g|STF_IngwerGemahlen:10g|STF_Kurkuma:15g|STF_Muskat:3g|STF_PaprikaDunkel:10g|STF_Kakao:2g|STF_Salz:2g;Pfeffer, Koriander, Kreuzkümmel leicht rösten. Abkühlen lassen. Nelken, Zimt, Piment, Muskat, Kurkuma und Ingwerpulver mischen. Alles fein mahlen. Kakao und dunklen Paprika untermischen. 1 Stunde ruhen lassen.;Rösten → Mahlen → Mischen → Ruhen;Max. 100–120 °C beim Rösten;Reife: 1 h|Lager: 3–4 Monate;1 TL pro Portion|In Öl anbraten für Tajines|Für dunkle Schmorgerichte;Kakao und Nelken können bei Überdosierung bitter werden;3–4 Monate;Aromadichte Dose;MIX-00000118-A;MIX-00000118;;;G;nan
MIX-OST-00010-G-000;G;OST-00010;Awaze Paste;Awaze Paste;Würzpaste;Dip|Scharf|Warm;Paste;Fleisch|Dips|Marinaden;Kalt|Mischen|Warm;scharf|süß-warm|würzig|leicht alkoholisch|tief aromatisch|rot;scharf|süß|warm;Afrika|Äthiopien;Addis Abeba;Äthiopische Wot-Küche;Awaze ist ein Tischgewürz, das durch die Kombination von Berbere-Gewürz, Honigwein (Tej) oder Rotwein und Honig entsteht. Der Alkoholgehalt ist gering und rundet die Schärfe ab.;dickflüssig|halbfest|tiefrot|glänzend;Kalt|Warm;STF_Berbere;STF_Knoblauch;;STF_OelNeutral;STF_Salz;STF_AlkoholTej|STF_Honig;Berbere|Honigwein|Öl|Honig|Knoblauch|Salz;STF_Berbere:80g|STF_AlkoholTej:35ml|STF_OelNeutral:25ml|STF_Honig:15g|STF_Knoblauch:8g|STF_Salz:2g;Berbere-Pulver in eine Schüssel geben. Honigwein oder Rotwein und Honig langsam einrühren. Knoblauch fein reiben und zugeben. Öl hinzufügen und glatt rühren. 1–2 Stunden ziehen lassen.;Mischen → Ruhen;Niemals erhitzen;Reife: 1–2 h|Lager: 5–7 Tage (gekühlt);1–2 TL als Dip|Marinade für Fleisch|In Niter Kibbeh lösen;Honig ist klebrig|Kühlung ist wichtig;5–7 Tage (gekühlt);Glas luftdicht;MIX-00000120-A;MIX-00000120;;;G;nan
MIX-OST-00011-G-000;G;OST-00011;Dukka (Sudan);Sudanese Dukka;Trockene Gewürzmischung;Nussig|Dip|Topping;Grob;Brot|Salate|Dips;Kalt|Mischen|Rösten;nussig|röstaromatisch|erdig|würzig|knusprig|tief;nussig|röstaromatisch|würzig;Afrika|Sudan;Khartum;Nordafrikanische|Sudanesische Küche;Dukka (auch Duqqa) ist ein ägyptisch-sudanesisches Nuss-Gewürz-Topping. Die sudanesische Variante ist einfacher, oft ohne Minze, und stärker auf geröstete Erdnüsse und Koriander fokussiert.;grobkörnig|knusprig|trocken;Kalt|Warm;STF_Kreuzkümmel|STF_Koriandersamen|STF_PfefferSchwarz;STF_OreganoGetr;STF_Salz;;;STF_ErdnuesseGeroestet;Erdnüsse|Koriander|Kreuzkümmel|Pfeffer|Salz;STF_ErdnuesseGeroestet:50g|STF_Koriandersamen:15g|STF_Kreuzkümmel:10g|STF_PfefferSchwarz:5g|STF_Salz:4g|STF_OreganoGetr:2g;Erdnüsse grob zerstoßen. Koriander und Kreuzkümmel mild rösten. Abkühlen lassen. Alle Zutaten grob mischen und mit Salz und Pfeffer abschmecken. Nicht zu fein mahlen.;Rösten → Zerstoßen → Mischen → Ruhen;Max. 130 °C beim Rösten;Reife: 1 h|Lager: 4–6 Wochen;Zum Dippen mit Brot und Öl|Als Kruste für Fleisch oder Fisch|Über Salate streuen;Erdnuss-Allergene|Nussigkeit reduziert Haltbarkeit;4–6 Wochen;Aromadichtes Glas;MIX-00000121-A;MIX-00000121;;;G;nan
MIX-OST-00012-G-000;G;OST-00012;Berbere Spice;Berbere Spice;Trockene Gewürzmischung;Curry|Scharf|Warm;Pulver;Wot|Linsen|Schmorgerichte;Warm|Anschwitzen|Mischen;scharf|warm|würzig|tiefrot|erdig|komplex|intensiv;scharf|erdig|warm;Afrika|Äthiopien|Eritrea;Addis Abeba;Äthiopische Wot-Küche;Berbere (sprich: „Bär-Bär-ee“) ist die zentrale, scharfe Allzweckmischung der äthiopisch-eritreischen Küche. Es basiert auf großen Mengen Chili und Ingwer, wird aber durch warme Gewürze wie Kardamom und Piment abgerundet.;fein gemahlen|tiefrot;Warm|Anschwitzen;STF_ChiliAethiopisch|STF_Kreuzkümmel|STF_Koriandersamen|STF_KardamomGruen|STF_Zimt|STF_Gewuerznelken|STF_Piment|STF_Ajwain|STF_Bockshornklee|STF_IngwerPulver|STF_KnoblauchPulver;;;;;Chili|Kreuzkümmel|Koriander|Kardamom|Zimt|Nelken|Piment|Ajwain|Bockshornklee|Ingwer|Knoblauch;STF_ChiliAethiopisch:30g|STF_Kreuzkümmel:10g|STF_Koriandersamen:10g|STF_KardamomGruen:5g|STF_Zimt:5g|STF_Gewuerznelken:2g|STF_Piment:3g|STF_Ajwain:2g|STF_Bockshornklee:1g|STF_IngwerPulver:10g|STF_KnoblauchPulver:8g;Alle ganzen Gewürze (Kreuzkümmel, Koriander, Kardamom, Piment, Ajwain, Bockshornklee) separat trocken rösten. Abkühlen lassen. Grob mahlen. Chili, Zimt, Nelken, Ingwer- und Knoblauchpulver untermischen. Alles sehr fein mahlen. 24 Stunden ruhen lassen.;Rösten → Abkühlen → Mahlen → Mischen → Ruhen;Max. 140 °C beim Rösten;Reife: 24 h|Lager: 3–4 Monate;1–2 EL als Basis für Wot|In Niter Kibbeh (geklärter Butter) anschwitzen;Chili-Staub vermeiden;3–4 Monate;Aromadichte Dose;MIX-00000122-A;MIX-00000122;;;G;nan
MIX-WEST-00008-G-000;G;WEST-00008;Shito Paste;Shito Paste;Würzpaste;Scharf|Umami|Meeresfrüchte;Paste;Reis|Eintöpfe|Fleisch|Fisch;Warm|Kochen;sehr scharf|fischig|rauchig|tief|umami-intensiv|ölig|aromatisch;scharf|fischig|umami;Afrika|Ghana|Westafrika;Accra;Ghanaische Küche;Shito ist die berühmteste Würzpaste Ghanas, oft mit getrockneten Garnelen (Kpakpo Shito) und viel Chili in Öl geschmort. Sie dient als Dip und als geschmackliche Basis.;ölig|dickflüssig|sehr dunkel;Warm|Kochen;STF_Kreuzkümmel|STF_Lorbeer;;STF_Salz;STF_OelNeutral;STF_Zwiebel|STF_Knoblauch|STF_Ingwer|STF_Tomate|STF_ChiliGetrScharf|STF_GarnelenGetr|STF_Tomatenmark;Getrocknete Garnelen|Zwiebel|Knoblauch|Ingwer|Chili|Kreuzkümmel|Lorbeer;STF_GarnelenGetr:15g|STF_Zwiebel:100g|STF_Knoblauch:30g|STF_Ingwer:20g|STF_Tomate:50g|STF_ChiliGetrScharf:30g|STF_OelNeutral:200ml|STF_Salz:8g|STF_Kreuzkümmel:2g|STF_Lorbeer:1g|STF_Tomatenmark:15g;Getrocknete Garnelen grob mahlen. Zwiebeln, Knoblauch, Ingwer fein pürieren. Öl erhitzen, Zwiebel-Mix langsam goldbraun schmoren (30 Min.). Tomatenmark zugeben, 5 Min. braten. Garnelen, Chili und Gewürze zugeben. Bei niedrigster Hitze 1–2 Stunden köcheln, bis das Öl die Oberfläche bedeckt.;Langes Schmoren → Köcheln → Reduzieren;Niedrigste Hitze (darf nicht anbrennen);Reife: 2 h|Lager: 4–6 Wochen (ungekühlt, mit Ölschicht)|3 Monate (gekühlt);1–2 TL pro Gericht|Zum Mischen in Jollof Reis|Als Dip zu gegrilltem Fleisch/Fisch;Hohe Schärfe|Garnelen-Allergene;4–6 Wochen (ungekühlt, Ölschicht);Luftdichtes Glas;MIX-00000123-A;MIX-00000123;;;G;nan
MIX-NOR-00011-G-000;G;NOR-00011;Harissa Paste (Trockenmix);Harissa Paste (Trockenmix);Trockene Gewürzmischung;Scharf|Dip|Marinade;Pulver;Couscous|Suppen|Dips|Marinaden;Warm|Kalt|Mischen;scharf|rauchig|tiefrot|fruchtig|aromatisch|warm;scharf|rauchig|fruchtig;Afrika|Tunesien;Tunesien;Nordafrikanische Küche;Harissa ist die bekannteste Würze Nordafrikas (besonders Tunesien). Der Trockenmix wird zu Hause mit Wasser und Öl zu einer Paste angerührt und basiert auf geräuchertem Chili und Koriander.;fein gemahlen|tiefrot;Kalt|Warm;STF_ChiliGetrScharf|STF_Koriandersamen|STF_Kreuzkuemmel|STF_KnoblauchPulver;STF_MinzeGetr|STF_Kreuzkuemmel;STF_Salz;;;STF_PaprikaGer;Chili|Koriander|Kreuzkümmel|Knoblauch|Minze|Paprika|Salz;STF_ChiliGetrScharf:50g|STF_Koriandersamen:15g|STF_Kreuzkuemmel:10g|STF_KnoblauchPulver:10g|STF_MinzeGetr:2g|STF_Salz:5g|STF_PaprikaGer:5g;Alle trockenen Gewürze mischen. (Zur Verwendung: Mit heißem Wasser und Olivenöl zu einer Paste anrühren und 30 Minuten ziehen lassen).;Mischen → Ruhen;Niedrige Hitze beim Anbraten;Reife: 1 h|Lager: 6 Monate (trocken);1–2 TL mit Öl/Wasser zur Paste anrühren|Basis für Saucen und Suppen|Marinade für Grillfleisch;Chili-Staub vermeiden|Sehr scharf;6 Monate (trocken);Aromadichte Dose;MIX-00000124-A;MIX-00000124;;;G;nan
MIX-NOR-00012-G-000;G;NOR-00012;Chermoula Paste;Chermoula Paste;Frische Würzpaste;Marinade|Fisch|Kräuter;Paste|Flüssig;Fisch|Meeresfrüchte|Gemüse;Kalt|Marinieren|Anschwitzen;frisch|zitronig|kräuterig|sauer|würzig|grün-gelb;frisch|zitronig|kräuterig;Afrika|Marokko|Tunesien;Marrakesch;Nordafrikanische Küche;Chermoula ist die klassische Marinade Nordafrikas, insbesondere für Fisch. Sie basiert auf frischen Kräutern, Knoblauch und Säure (Zitrone/Essig), oft mit Kurkuma für die gelbe Farbe.;grob|feucht|frisch;Kalt|Warm;STF_Kreuzkuemmel|STF_Kurkuma|STF_PaprikaEdelsuess;STF_KorianderFrisch|STF_PetersilieFrisch;;STF_OelNeutral;STF_Salz;STF_Knoblauch|STF_Zitrone|STF_EssigWeisswein|STF_ChiliGruenFrisch;Koriander|Petersilie|Knoblauch|Zitrone|Kreuzkümmel|Kurkuma|Öl|Salz;STF_KorianderFrisch:40g|STF_PetersilieFrisch:20g|STF_Knoblauch:15g|STF_Zitrone:25ml|STF_EssigWeisswein:10ml|STF_OelNeutral:30ml|STF_Salz:4g|STF_Kreuzkuemmel:3g|STF_Kurkuma:2g|STF_PaprikaEdelsuess:2g|STF_ChiliGruenFrisch:5g;Alle frischen Zutaten grob hacken. Mit Kreuzkümmel, Kurkuma und Salz in den Mixer geben. Essig, Öl und Zitronensaft hinzufügen. Zu einer groben, feuchten Paste pürieren. 1–2 Stunden ziehen lassen.;Pürieren → Mischen → Ruhen;Niedrige Hitze;Reife: 1–2 h|Lager: 3–4 Tage (gekühlt);Als Marinade (1–4 h)|Als Tischsauce|Für Tajines mit Fisch/Gemüse;Frische Kräuter → Oxidation;3–4 Tage (gekühlt);Luftdichtes Glas;MIX-00000125-A;MIX-00000125;;;G;nan
